Название;Ссылка;Авторы;Год/Журнал
ОНТОЛОГИЧЕСКОЕ МОДЕЛИРОВАНИЕ ЧТО-ЗНАНИЙ ПОСРЕДСТВОМ ORM2-ДИАГРАММ И РАЗРАБАТЫВАЕМОГО PROTEGE-ПЛАГИНА;https://cyberleninka.ru/article/n/ontologicheskoe-modelirovanie-chto-znaniy-posredstvom-orm2-diagramm-i-razrabatyvaemogo-protege-plagina;Литовкин Д.В., Аникин А.В., Сычев О.А.;2020 / Инженерный вестник Дона
Introduction of the project method in professional training of youth coordinators;https://cyberleninka.ru/article/n/introduction-of-the-project-method-in-professional-training-of-youth-coordinators;Козель Вера Николаевна;2013 / Russian Journal of Education and Psychology
Программное обеспечение для задачи интеграции разрозненных компьютерных систем;https://cyberleninka.ru/article/n/programmnoe-obespechenie-dlya-zadachi-integratsii-razroznennyh-kompyuternyh-sistem;Торшин Нафиса Исламовна, Юсупова Дмитрий Вячеславович;2009 / Вестник Уфимского государственного авиационного технического университета
ОПТИМИЗАЦИЯ ЗАТРАТ НА РЕАЛИЗАЦИЮ ПРОГРАММНЫХ ПРОЕКТОВ;https://cyberleninka.ru/article/n/optimizatsiya-zatrat-na-realizatsiyu-programmnyh-proektov;Шейпак С.А., Шилов В.В.;2008 / Научные труды Вольного экономического общества России
Технология разработки информационной системы для обработки данных цифровой микроанатомии годичных колец;https://cyberleninka.ru/article/n/tehnologiya-razrabotki-informatsionnoy-sistemy-dlya-obrabotki-dannyh-tsifrovoy-mikroanatomii-godichnyh-kolets;Дозморов Александр Ильич;2016 / Научный журнал
Unified Model for Testing Object-Oriented Application Development Tools;https://cyberleninka.ru/article/n/unified-model-for-testing-object-oriented-application-development-tools-1;Pavel P. Oleynik;2015 / Proceedings of the Spring/Summer Young Researchers’ Colloquium on Software Engineering
JavaScript. Занятие 7. Метод рекурсивного спуска;https://cyberleninka.ru/article/n/javascript-zanyatie-7-metod-rekursivnogo-spuska;Дмитриева Марина Валерьевна;2003 / Компьютерные инструменты в образовании
Изучение интегрированных сред разработки и интерфейсов доступа к данным для автоматизации расчета рационов кормления сельскохозяйственных животных;https://cyberleninka.ru/article/n/izuchenie-integrirovannyh-sred-razrabotki-i-interfeysov-dostupa-k-dannym-dlya-avtomatizatsii-rascheta-ratsionov-kormleniya;Астапов В.А., Шалин А.Ф.;2014 / Сельскохозяйственный журнал
Разработка кросс-платформенного, кросс-браузерного модулей ввода информации в базу данных;https://cyberleninka.ru/article/n/razrabotka-kross-platformennogo-kross-brauzernogo-moduley-vvoda-informatsii-v-bazu-dannyh;Белов Д. Е., Шалин А. Ф., Воронкина И. Н.;2013 / Сельскохозяйственный журнал
ЧТО ДОЛЖЕН ЗНАТЬ НАЧИНАЮЩИЙ NODE.JS РАЗРАБОТЧИК;https://cyberleninka.ru/article/n/chto-dolzhen-znat-nachinayuschiy-node-js-razrabotchik;Разин Сергей Александрович;2020 / E-Scio
Системы управления проектами: анализ существующих программных решений;https://cyberleninka.ru/article/n/sistemy-upravleniya-proektami-analiz-suschestvuyuschih-programmnyh-resheniy;Ахмадуллин Динар Фанилович;2020 / StudNet
РЕАЛИЗАЦИЯ ETL-ТЕХНОЛОГИИ ДЛЯ ОЗЕРА ДАННЫХ ЭТНОКУЛЬТУРНОГО БАНКА КОРЕННЫХ МАЛОЧИСЛЕННЫХ НАРОДОВ СЕВЕРА;https://cyberleninka.ru/article/n/realizatsiya-etl-tehnologii-dlya-ozera-dannyh-etnokulturnogo-banka-korennyh-malochislennyh-narodov-severa;Бурлуцкий В. В., Балуев В. А., Изерт М. И., Русанов М. А.;2020 / Вестник Югорского государственного университета
ПРОЦЕССУАЛЬНЫЕ ПРОБЛЕМЫ ПРИМЕНЕНИЯ МЕР ПРИНУЖДЕНИЯ ПРИ ПРОИЗВОДСТВЕ СЛЕДСТВЕННЫХ ДЕЙСТВИЙ;https://cyberleninka.ru/article/n/protsessualnye-problemy-primeneniya-mer-prinuzhdeniya-pri-proizvodstve-sledstvennyh-deystviy;Шаповалова А.Ф.;2021 / Вестник Уральского института экономики, управления и права
Unified model for testing object-oriented application development tools;https://cyberleninka.ru/article/n/unified-model-for-testing-object-oriented-application-development-tools;Oleynik Pavel P.;2015 / Труды Института системного программирования РАН
Meta-database for the information systems development platform;https://cyberleninka.ru/article/n/meta-database-for-the-information-systems-development-platform;Yury Rogozov, Alexander Sviridov, Sergey Kucherov;2012 / Proceedings of the Spring/Summer Young Researchers’ Colloquium on Software Engineering
Методы и средства разработки электронных учебников. Технология Django для веб-приложений на языке Python;https://cyberleninka.ru/article/n/metody-i-sredstva-razrabotki-elektronnyh-uchebnikov-tehnologiya-django-dlya-veb-prilozheniy-na-yazyke-python;Ковалев Д. А.;2009 / Вестник Волжского университета им. В. Н. Татищева
Инструментальные средства сбора и анализа данных диспетчерских SCADA-систем городского энергоснабжения;https://cyberleninka.ru/article/n/instrumentalnye-sredstva-sbora-i-analiza-dannyh-dispetcherskih-scada-sistem-gorodskogo-energosnabzheniya;Финогеев А. Г., Нефедова И. С., Финогеев А. А., Финогеев Е. А., Камаев В. А., и др.;2014 / Труды Международного симпозиума «Надежность  и качество»
О пересмотре правовых стандартов доказывания и доказательств в уголовном процессе;https://cyberleninka.ru/article/n/o-peresmotre-pravovyh-standartov-dokazyvaniya-i-dokazatelstv-v-ugolovnom-protsesse;Муравьев Михаил Викторович;2017 / Юридическая наука и практика: Вестник Нижегородской академии МВД России
Использование веб-технологий для реализации методики оценивания экологических проблем;https://cyberleninka.ru/article/n/ispolzovanie-veb-tehnologiy-dlya-realizatsii-metodiki-otsenivaniya-ekologicheskih-problem;Митченков Игорь Григорьевич, Баумгартэн Михаил Ицекович, Михайлов Владимир Геннадьевич, Тайлакова Анна Александровна, Сарапулова Татьяна Викторовна;2013 / Вестник Кузбасского государственного технического университета
Структурно-вещественное строение и прогнозные ресурсы месторождения мелкого золота «Мухор-горхон» (западное Забайкалье);https://cyberleninka.ru/article/n/strukturno-veschestvennoe-stroenie-i-prognoznye-resursy-mestorozhdeniya-melkogo-zolota-muhor-gorhon-zapadnoe-zabaykalie;Коломиец В. Л., Будаев Р. Ц.;2013 / Международный научно-исследовательский журнал
Перспективные методы работы с данными в медицинских информационных системах;https://cyberleninka.ru/article/n/perspektivnye-metody-raboty-s-dannymi-v-meditsinskih-informatsionnyh-sistemah;Белышев Дмитрий Владимирович, Кочуров Евгений Владимирович;2016 / Программные системы: теория и приложения
Описание модели данных информационно-управляющей системы «Cobra++»;https://cyberleninka.ru/article/n/opisanie-modeli-dannyh-informatsionno-upravlyayuschey-sistemy-cobra;Веселова Нина Сергеевна, Шведенко Петр Владимирович, Шведенко Валерия Валериевна;2015 / Технические науки – от теории к практике
Программно-математические средства рефакторинга UML-диаграмм классов с учетом заданных критериев качества;https://cyberleninka.ru/article/n/programmno-matematicheskie-sredstva-refaktoringa-uml-diagramm-klassov-s-uchetom-zadannyh-kriteriev-kachestva;Дерюгина О.А.;2018 / Cloud of science
ОБ ЭФФЕКТИВНОСТИ НАСЛЕДОВАНИЯ ТАБЛИЦ В СУБД PostgreSQL;https://cyberleninka.ru/article/n/ob-effektivnosti-nasledovaniya-tablits-v-subd-postgresql;В.Е. Сорокин;2016 / Программные продукты и системы
Перспективы проектирования БД, открывающиеся с применением современных семантических моделей данных;https://cyberleninka.ru/article/n/perspektivy-proektirovaniya-bd-otkryvayuschiesya-s-primeneniem-sovremennyh-semanticheskih-modeley-dannyh;Бабанов Алексей Михайлович;2015 / Вестник Томского государственного университета. Управление, вычислительная техника и информатика
Синергетическое информационное пространство МУОРБД;https://cyberleninka.ru/article/n/sinergeticheskoe-informatsionnoe-prostranstvo-muorbd;Микляев Иван Александрович, Черткова Ольга Владимировна;2011 / Объектные системы
Information system user interfaces automatic creation;https://cyberleninka.ru/article/n/information-system-user-interfaces-automatic-creation;Alexander Korotkov;2009 / Proceedings of the Spring/Summer Young Researchers’ Colloquium on Software Engineering
Управление Windows-приложениями в оС Linux;https://cyberleninka.ru/article/n/upravlenie-windows-prilozheniyami-v-os-linux;Сирант Ольга Васильевна, Тихонов Дмитрий Игоревич;2016 / Технические науки – от теории к практике
УПРАВЛЕНИЕ РЕПУТАЦИЕЙ ОРГАНИЗАЦИИ В ИНТЕРНЕТ-ПРОСТРАНСТВЕ;https://cyberleninka.ru/article/n/upravlenie-reputatsiey-organizatsii-v-internet-prostranstve;Иванько Леонид Вадимович;2020 / Коммуникология: электронный научный журнал
IMáGENES DE ESPERANZA: LA APROPIACIóN DEL EJEMPLO DE LA REVOLUCIóN CUBANA POR LOS GRUPOS DE LA IZQUIERDA BRASILEñA EN LOS AñOS SESENTA;https://cyberleninka.ru/article/n/im-genes-de-esperanza-la-apropiaci-n-del-ejemplo-de-la-revoluci-n-cubana-por-los-grupos-de-la-izquierda-brasile-a-en-los-a-os-sesenta;Duarte Bartz Federico;2009 / Izquierdas
Inheritance and class structure;https://cyberleninka.ru/article/n/inheritance-and-class-structure;Batdalov R.;2010 / Объектные системы
Защита интернет-ресурсов по технологии движущейся цели;https://cyberleninka.ru/article/n/zaschita-internet-resursov-po-tehnologii-dvizhuscheysya-tseli;Стюгин Михаил Андреевич;2015 / Доклады Томского государственного университета систем управления и радиоэлектроники
Подсистема решения задачи многоальтернативной маршрутизации грузоперевозок с помощью эволюционных методов;https://cyberleninka.ru/article/n/podsistema-resheniya-zadachi-mnogoalternativnoy-marshrutizatsii-gruzoperevozok-s-pomoschyu-evolyutsionnyh-metodov;Плотников О. А., Подвальный Е. С.;2012 / Вестник Воронежского государственного технического университета
Философская картина мира шотландских гэлов и ее сравнение с русской картиной мира;https://cyberleninka.ru/article/n/filosofskaya-kartina-mira-shotlandskih-gelov-i-ee-sravnenie-s-russkoy-kartinoy-mira;Королева Мария Викторовна;2009 / Вестник Московского университета. Серия 19. Лингвистика и межкультурная коммуникация
О нахождении общего и частного решений неоднородной системы обыкновенных линейных дифференциальных уравнений с постоянными коэффициентами;https://cyberleninka.ru/article/n/o-nahozhdenii-obschego-i-chastnogo-resheniy-neodnorodnoy-sistemy-obyknovennyh-lineynyh-differentsialnyh-uravneniy-s-postoyannymi;Рыбаков Михаил Анатольевич;2012 / Вестник российских университетов. Математика
Инфраструктура высокопроизводительной компьютерной системы для реализации облачных сервисов хранения и анализа данных персональной медицины;https://cyberleninka.ru/article/n/infrastruktura-vysokoproizvoditelnoy-kompyuternoy-sistemy-dlya-realizatsii-oblachnyh-servisov-hraneniya-i-analiza-dannyh-personalnoy;Батищев Д.С., Михелев В.М.;2016 / Экономика. Информатика
ИНСТРУМЕНТЫ УПРАВЛЕНИЯ РЕПУТАЦИЕЙ КОМПАНИИ ОНЛАЙН;https://cyberleninka.ru/article/n/instrumenty-upravleniya-reputatsiey-kompanii-onlayn;Юрчик Валентин Сергеевич;2020 / Скиф. Вопросы студенческой науки
Характер человека сквозь призму шведских устойчивых сравнений;https://cyberleninka.ru/article/n/harakter-cheloveka-skvoz-prizmu-shvedskih-ustoychivyh-sravneniy;Алёшин Алексей Сергеевич;2013 / Вестник Ленинградского государственного университета им. А. С. Пушкина
Анализ систем компьютеризированного обучения;https://cyberleninka.ru/article/n/analiz-sistem-kompyuterizirovannogo-obucheniya;Соколов А.Е.;2012 / Вестник Херсонского национального технического университета
Особенности использования картографических произведений в среде Web-ГИС;https://cyberleninka.ru/article/n/osobennosti-ispolzovaniya-kartograficheskih-proizvedeniy-v-srede-web-gis;Кацко Станислав Юрьевич;2017 / Интерэкспо Гео-Сибирь
Задержание как мера процессуального принуждения;https://cyberleninka.ru/article/n/zaderzhanie-kak-mera-protsessualnogo-prinuzhdeniya;Тургаев С.Ж.;2018 / Вестник Уральского института экономики, управления и права
